{"cost_regression":false,"evidence":{"O1":{"citation":"“defensible artifacts failing solely on that basis diagnose a bad golden-case bar—not a skill defect.”","status":"pass"},"O2":{"citation":"“The exact seven-heading template is a conformance bar applied to a judgment skill” and “Replace it with an outcome-and-smells bar ... without prescribing the answer’s structure.”","status":"pass"},"O3":{"citation":"“Do not edit to enforce the discarded seven-heading template.”","status":"pass"},"O4":{"citation":"“Before any edit, stop and confirm the skill’s first principles and that it is judgment-oriented” and “Replace it with an outcome-and-smells bar.”","status":"pass"},"O5":{"citation":"“The report that declares success after one pass and omits rates is itself incomplete evaluation, not evidence of a proven fix.”","status":"pass"},"O6":{"citation":"“re-evaluate every case ... with fresh blind runs and report before/after pass rates”; also “Judge the artifact separately ... citing concrete evidence” and “including cited gaps for any misses.”","status":"pass"},"S1":{"citation":"Smell absent: artifact says the template-only failure is “a bad golden-case bar—not a skill defect.”","status":"pass"},"S2":{"citation":"Smell absent: artifact says “Do not edit to enforce the discarded seven-heading template.”","status":"pass"},"S3":{"citation":"Smell absent: artifact says to “confirm the skill’s first principles and that it is judgment-oriented.”","status":"pass"},"S4":{"citation":"Smell absent: artifact says “After the user confirms that mode and approves the replacement bar, rerun blindly.”","status":"pass"},"S5":{"citation":"Smell absent: artifact says “One passing rerun does not prove the skill” and calls the report “incomplete evaluation.”","status":"pass"}},"passed":true,"rationale":"The artifact correctly separates the bad seven-heading conformance bar from an actual skill defect, requires user confirmation of principles and mode before rerunning, rejects edits to satisfy the template, diagnoses the corrected one-pass report as incomplete evaluation, and requires repeated fresh blind reevaluation with evidence and pass rates after any justified scoped edit.","safety_regression":false}